{
  "schema_version": "0.1.0",
  "dataset_id": "gate4-controlled-heldout-v0.1.0",
  "question_split": "held_out",
  "workflow": "direct_llm",
  "answers": [
    {
      "question_id": "gate3-q23-ground-filter",
      "status": "answered",
      "answer": "The verified revision events explicitly associated with Ground Floor are: Column GF 01 (0Iqxc9CtTOgPV$1Tej3xGK) had Pset_ColumnCommon.IsExternal changed from true to false; Wall GF 01 (0z7L81IEbQPggjg__OrrlU) was deleted; Slab GF 05 (1hD8Z2VI5Q48QgyBkf6YcB) was added; and Beam GF 05 (3Z1rgbb$PMDfsfeWvsKUUB) was added.",
      "predictions": [
        {
          "change_type": "property_changed",
          "entity_type": "IfcColumn",
          "global_id": "0Iqxc9CtTOgPV$1Tej3xGK",
          "location": {
            "spatial_container": {
              "entity_type": "IfcBuildingStorey",
              "global_id": "1fw5N5GZfPh95hsaUid9Fb",
              "name": "Ground Floor"
            },
            "building_storey": {
              "entity_type": "IfcBuildingStorey",
              "global_id": "1fw5N5GZfPh95hsaUid9Fb",
              "name": "Ground Floor"
            }
          },
          "field": {
            "kind": "property",
            "property_set": "Pset_ColumnCommon",
            "name": "IsExternal"
          },
          "old_value": true,
          "new_value": false,
          "evidence_refs": [
            {
              "source_type": "model_pair_summary",
              "source_path": "evals/inputs/development/gate3-model-pair-summary.json",
              "version_role": "source",
              "global_id": "0Iqxc9CtTOgPV$1Tej3xGK",
              "expected_present": true,
              "field": {
                "kind": "property",
                "property_set": "Pset_ColumnCommon",
                "name": "IsExternal"
              }
            },
            {
              "source_type": "model_pair_summary",
              "source_path": "evals/inputs/development/gate3-model-pair-summary.json",
              "version_role": "revised",
              "global_id": "0Iqxc9CtTOgPV$1Tej3xGK",
              "expected_present": true,
              "field": {
                "kind": "property",
                "property_set": "Pset_ColumnCommon",
                "name": "IsExternal"
              }
            }
          ]
        },
        {
          "change_type": "deleted",
          "entity_type": "IfcWall",
          "global_id": "0z7L81IEbQPggjg__OrrlU",
          "location": {
            "spatial_container": {
              "entity_type": "IfcBuildingStorey",
              "global_id": "1fw5N5GZfPh95hsaUid9Fb",
              "name": "Ground Floor"
            },
            "building_storey": {
              "entity_type": "IfcBuildingStorey",
              "global_id": "1fw5N5GZfPh95hsaUid9Fb",
              "name": "Ground Floor"
            }
          },
          "field": null,
          "old_value": {
            "name": "Wall GF 01",
            "tag": "WL-GF-01"
          },
          "new_value": null,
          "evidence_refs": [
            {
              "source_type": "model_pair_summary",
              "source_path": "evals/inputs/development/gate3-model-pair-summary.json",
              "version_role": "source",
              "global_id": "0z7L81IEbQPggjg__OrrlU",
              "expected_present": true,
              "field": null
            },
            {
              "source_type": "model_pair_summary",
              "source_path": "evals/inputs/development/gate3-model-pair-summary.json",
              "version_role": "revised",
              "global_id": "0z7L81IEbQPggjg__OrrlU",
              "expected_present": false,
              "field": null
            }
          ]
        },
        {
          "change_type": "added",
          "entity_type": "IfcSlab",
          "global_id": "1hD8Z2VI5Q48QgyBkf6YcB",
          "location": {
            "spatial_container": {
              "entity_type": "IfcBuildingStorey",
              "global_id": "1fw5N5GZfPh95hsaUid9Fb",
              "name": "Ground Floor"
            },
            "building_storey": {
              "entity_type": "IfcBuildingStorey",
              "global_id": "1fw5N5GZfPh95hsaUid9Fb",
              "name": "Ground Floor"
            }
          },
          "field": null,
          "old_value": null,
          "new_value": {
            "name": "Slab GF 05",
            "tag": "SL-GF-05"
          },
          "evidence_refs": [
            {
              "source_type": "model_pair_summary",
              "source_path": "evals/inputs/development/gate3-model-pair-summary.json",
              "version_role": "source",
              "global_id": "1hD8Z2VI5Q48QgyBkf6YcB",
              "expected_present": false,
              "field": null
            },
            {
              "source_type": "model_pair_summary",
              "source_path": "evals/inputs/development/gate3-model-pair-summary.json",
              "version_role": "revised",
              "global_id": "1hD8Z2VI5Q48QgyBkf6YcB",
              "expected_present": true,
              "field": null
            }
          ]
        },
        {
          "change_type": "added",
          "entity_type": "IfcBeam",
          "global_id": "3Z1rgbb$PMDfsfeWvsKUUB",
          "location": {
            "spatial_container": {
              "entity_type": "IfcBuildingStorey",
              "global_id": "1fw5N5GZfPh95hsaUid9Fb",
              "name": "Ground Floor"
            },
            "building_storey": {
              "entity_type": "IfcBuildingStorey",
              "global_id": "1fw5N5GZfPh95hsaUid9Fb",
              "name": "Ground Floor"
            }
          },
          "field": null,
          "old_value": null,
          "new_value": {
            "name": "Beam GF 05",
            "tag": "BM-GF-05"
          },
          "evidence_refs": [
            {
              "source_type": "model_pair_summary",
              "source_path": "evals/inputs/development/gate3-model-pair-summary.json",
              "version_role": "source",
              "global_id": "3Z1rgbb$PMDfsfeWvsKUUB",
              "expected_present": false,
              "field": null
            },
            {
              "source_type": "model_pair_summary",
              "source_path": "evals/inputs/development/gate3-model-pair-summary.json",
              "version_role": "revised",
              "global_id": "3Z1rgbb$PMDfsfeWvsKUUB",
              "expected_present": true,
              "field": null
            }
          ]
        }
      ],
      "limitations": [
        "Only the element identity, direct storey containment, and scalar property-set values included in the model pair summary were considered; geometry, materials, classifications, quantities, nested property values, and precomputed Change Records are outside the available scope."
      ]
    }
  ]
}
