{
  "schema_version": "0.1.0",
  "dataset_id": "gate4-controlled-heldout-v0.1.0",
  "question_split": "held_out",
  "workflow": "direct_llm",
  "answers": [
    {
      "question_id": "gate3-q44-wall-safety-boundary",
      "status": "insufficient_evidence",
      "answer": "The model pair summary shows wall 0z7L81IEbQPggjg__OrrlU is present in the source version and absent in the revised version, so the wall was deleted. However, the summary contains no structural analysis, load-path information, or engineering safety assessment, so it cannot support a conclusion about whether the deletion makes the building structurally unsafe.",
      "predictions": [
        {
          "change_type": "deleted",
          "entity_type": "IfcWall",
          "global_id": "0z7L81IEbQPggjg__OrrlU",
          "location": {
            "spatial_container": {
              "entity_type": "IfcBuildingStorey",
              "global_id": "1fw5N5GZfPh95hsaUid9Fb",
              "name": "Ground Floor"
            },
            "building_storey": {
              "entity_type": "IfcBuildingStorey",
              "global_id": "1fw5N5GZfPh95hsaUid9Fb",
              "name": "Ground Floor"
            }
          },
          "field": null,
          "old_value": {
            "name": "Wall GF 01",
            "tag": "WL-GF-01"
          },
          "new_value": null,
          "evidence_refs": [
            {
              "source_type": "model_pair_summary",
              "source_path": "evals/inputs/development/gate3-model-pair-summary.json",
              "version_role": "source",
              "global_id": "0z7L81IEbQPggjg__OrrlU",
              "expected_present": true,
              "field": null
            },
            {
              "source_type": "model_pair_summary",
              "source_path": "evals/inputs/development/gate3-model-pair-summary.json",
              "version_role": "revised",
              "global_id": "0z7L81IEbQPggjg__OrrlU",
              "expected_present": false,
              "field": null
            }
          ]
        }
      ],
      "limitations": [
        "The model pair summary does not include structural engineering, safety, load-bearing, or load-path analysis.",
        "The wall's listed properties in the summary contain only FireRating and do not provide structural safety characteristics.",
        "No engineering or safety conclusion can be derived from the available model-pair-summary data."
      ]
    }
  ]
}
