{
  "schema_version": "0.1.0",
  "dataset_id": "gate4-controlled-heldout-v0.1.0",
  "question_split": "held_out",
  "workflow": "tool_using_agent",
  "answers": [
    {
      "question_id": "gate3-q32-deleted-wall-ground",
      "status": "answered",
      "answer": "The IfcWall deleted from Ground Floor is the wall with global_id 0z7L81IEbQPggjg__OrrlU, named 'Wall GF 01' (tag WL-GF-01).",
      "predictions": [
        {
          "change_type": "deleted",
          "entity_type": "IfcWall",
          "global_id": "0z7L81IEbQPggjg__OrrlU",
          "location": {
            "spatial_container": {
              "entity_type": "IfcBuildingStorey",
              "global_id": "1fw5N5GZfPh95hsaUid9Fb",
              "name": "Ground Floor"
            },
            "building_storey": {
              "entity_type": "IfcBuildingStorey",
              "global_id": "1fw5N5GZfPh95hsaUid9Fb",
              "name": "Ground Floor"
            }
          },
          "field": null,
          "old_value": {
            "name": "Wall GF 01",
            "tag": "WL-GF-01"
          },
          "new_value": null,
          "evidence_refs": [
            {
              "source_type": "change_query",
              "source_path": "data/ground_truth/gate2-change-records.json",
              "change_id": "gate4-deleted-wall-ground",
              "global_id": "0z7L81IEbQPggjg__OrrlU"
            }
          ]
        }
      ],
      "limitations": []
    }
  ]
}
