{
  "schema_version": "0.1.0",
  "dataset_id": "gate4-controlled-heldout-v0.1.0",
  "question_split": "held_out",
  "workflow": "proposed",
  "answers": [
    {
      "question_id": "gate3-q14-wall-ground-guid",
      "status": "answered",
      "answer": "The verified revision event for element 0z7L81IEbQPggjg__OrrlU is 'gate4-deleted-wall-ground': the IFC wall (named 'Wall GF 01' with tag 'WL-GF-01') was deleted from the Ground Floor storey.",
      "predictions": [
        {
          "change_type": "deleted",
          "entity_type": "IfcWall",
          "global_id": "0z7L81IEbQPggjg__OrrlU",
          "location": {
            "spatial_container": {
              "entity_type": "IfcBuildingStorey",
              "global_id": "1fw5N5GZfPh95hsaUid9Fb",
              "name": "Ground Floor"
            },
            "building_storey": {
              "entity_type": "IfcBuildingStorey",
              "global_id": "1fw5N5GZfPh95hsaUid9Fb",
              "name": "Ground Floor"
            }
          },
          "field": null,
          "old_value": {
            "name": "Wall GF 01",
            "tag": "WL-GF-01"
          },
          "new_value": null,
          "evidence_refs": [
            {
              "source_type": "change_query",
              "source_path": "data/ground_truth/gate2-change-records.json",
              "change_id": "gate4-deleted-wall-ground",
              "global_id": "0z7L81IEbQPggjg__OrrlU"
            }
          ]
        }
      ],
      "limitations": [
        "Field-level property values are not available for this deletion event; only the pre-deletion object name and tag are provided."
      ]
    }
  ]
}
