{
  "schema_version": "0.1.0",
  "dataset_id": "gate4-controlled-heldout-v0.1.0",
  "question_split": "held_out",
  "workflow": "proposed",
  "answers": [
    {
      "question_id": "gate3-q42-no-deleted-column-ground",
      "status": "not_found",
      "answer": "No IfcColumn deleted from Ground Floor was found in the change records.",
      "predictions": [],
      "limitations": [
        "The conclusion is limited to records in data/ground_truth/gate2-change-records.json for deleted IfcColumn entities on Ground Floor."
      ]
    }
  ]
}
