{
  "schema_version": "0.1.0",
  "dataset_id": "gate4-controlled-heldout-v0.1.0",
  "question_split": "held_out",
  "workflow": "tool_using_agent",
  "answers": [
    {
      "question_id": "gate3-q29-beam-roof-filter",
      "status": "answered",
      "answer": "One verified revision event involves an IfcBeam on Roof: the beam with global ID 3JuqHVfXrLlA8tnQP5xv53 had its LoadBearing property in Pset_BeamCommon modified from false to true.",
      "predictions": [
        {
          "change_type": "property_modified",
          "entity_type": "IfcBeam",
          "global_id": "3JuqHVfXrLlA8tnQP5xv53",
          "location": {
            "spatial_container": {
              "entity_type": "IfcBuildingStorey",
              "global_id": "3Oz3veLPTRYhlejGdV1B7j",
              "name": "Roof"
            },
            "building_storey": {
              "entity_type": "IfcBuildingStorey",
              "global_id": "3Oz3veLPTRYhlejGdV1B7j",
              "name": "Roof"
            }
          },
          "field": {
            "kind": "property",
            "property_set": "Pset_BeamCommon",
            "name": "LoadBearing"
          },
          "old_value": false,
          "new_value": true,
          "evidence_refs": [
            {
              "source_type": "change_query",
              "source_path": "data/ground_truth/gate2-change-records.json",
              "change_id": "gate4-property-beam-roof",
              "global_id": "3JuqHVfXrLlA8tnQP5xv53"
            }
          ]
        }
      ],
      "limitations": [
        "Only the supplied verified change records were considered; no other IfcBeam-on-Roof events were found in that source."
      ]
    }
  ]
}
