{
  "schema_version": "0.1.0",
  "dataset_id": "gate4-controlled-heldout-v0.1.0",
  "question_split": "held_out",
  "workflow": "proposed",
  "answers": [
    {
      "question_id": "gate3-q36-slab-property",
      "status": "answered",
      "answer": "The scalar property LoadBearing in Pset_SlabCommon changed from false to true for IfcSlab 2WfINAQAHRERPwEp7Nos0$.",
      "predictions": [
        {
          "change_type": "property_modified",
          "entity_type": "IfcSlab",
          "global_id": "2WfINAQAHRERPwEp7Nos0$",
          "location": {
            "spatial_container": {
              "entity_type": "IfcBuildingStorey",
              "global_id": "3Oz3veLPTRYhlejGdV1B7j",
              "name": "Roof"
            },
            "building_storey": {
              "entity_type": "IfcBuildingStorey",
              "global_id": "3Oz3veLPTRYhlejGdV1B7j",
              "name": "Roof"
            }
          },
          "field": {
            "kind": "property",
            "property_set": "Pset_SlabCommon",
            "name": "LoadBearing"
          },
          "old_value": false,
          "new_value": true,
          "evidence_refs": [
            {
              "source_type": "change_query",
              "source_path": "data/ground_truth/gate2-change-records.json",
              "change_id": "gate4-property-slab-roof",
              "global_id": "2WfINAQAHRERPwEp7Nos0$"
            }
          ]
        }
      ],
      "limitations": []
    }
  ]
}
