{
  "schema_version": "0.1.0",
  "dataset_id": "gate4-controlled-heldout-v0.1.0",
  "question_split": "held_out",
  "workflow": "proposed",
  "answers": [
    {
      "question_id": "gate3-q22-slab-filter",
      "status": "answered",
      "answer": "Verified revision events involving IfcSlab elements: (1) added slab 'Slab GF 05' (SL-GF-05) in Ground Floor; (2) deleted slab 'Slab L1 01' (SL-L1-01) in Level 01; (3) property change LoadBearing from false to true in Pset_SlabCommon for the slab in Roof.",
      "predictions": [
        {
          "change_type": "added",
          "entity_type": "IfcSlab",
          "global_id": "1hD8Z2VI5Q48QgyBkf6YcB",
          "location": {
            "spatial_container": {
              "entity_type": "IfcBuildingStorey",
              "global_id": "1fw5N5GZfPh95hsaUid9Fb",
              "name": "Ground Floor"
            },
            "building_storey": {
              "entity_type": "IfcBuildingStorey",
              "global_id": "1fw5N5GZfPh95hsaUid9Fb",
              "name": "Ground Floor"
            }
          },
          "field": null,
          "old_value": null,
          "new_value": {
            "name": "Slab GF 05",
            "tag": "SL-GF-05"
          },
          "evidence_refs": [
            {
              "source_type": "change_query",
              "source_path": "data/ground_truth/gate2-change-records.json",
              "change_id": "gate4-added-slab-ground",
              "global_id": "1hD8Z2VI5Q48QgyBkf6YcB"
            }
          ]
        },
        {
          "change_type": "deleted",
          "entity_type": "IfcSlab",
          "global_id": "3QgprvELLQBgvTF$EPliSW",
          "location": {
            "spatial_container": {
              "entity_type": "IfcBuildingStorey",
              "global_id": "16B$afW8bSivOT_ExWbFiL",
              "name": "Level 01"
            },
            "building_storey": {
              "entity_type": "IfcBuildingStorey",
              "global_id": "16B$afW8bSivOT_ExWbFiL",
              "name": "Level 01"
            }
          },
          "field": null,
          "old_value": {
            "name": "Slab L1 01",
            "tag": "SL-L1-01"
          },
          "new_value": null,
          "evidence_refs": [
            {
              "source_type": "change_query",
              "source_path": "data/ground_truth/gate2-change-records.json",
              "change_id": "gate4-deleted-slab-level01",
              "global_id": "3QgprvELLQBgvTF$EPliSW"
            }
          ]
        },
        {
          "change_type": "property_modified",
          "entity_type": "IfcSlab",
          "global_id": "2WfINAQAHRERPwEp7Nos0$",
          "location": {
            "spatial_container": {
              "entity_type": "IfcBuildingStorey",
              "global_id": "3Oz3veLPTRYhlejGdV1B7j",
              "name": "Roof"
            },
            "building_storey": {
              "entity_type": "IfcBuildingStorey",
              "global_id": "3Oz3veLPTRYhlejGdV1B7j",
              "name": "Roof"
            }
          },
          "field": {
            "kind": "property",
            "property_set": "Pset_SlabCommon",
            "name": "LoadBearing"
          },
          "old_value": false,
          "new_value": true,
          "evidence_refs": [
            {
              "source_type": "change_query",
              "source_path": "data/ground_truth/gate2-change-records.json",
              "change_id": "gate4-property-slab-roof",
              "global_id": "2WfINAQAHRERPwEp7Nos0$"
            }
          ]
        }
      ],
      "limitations": [
        "The listed events are those verified in the queried gate2-change-records.json source; no other IfcSlab revision events are claimed."
      ]
    }
  ]
}
