{
  "schema_version": "0.1.0",
  "dataset_id": "gate4-controlled-heldout-v0.1.0",
  "question_split": "held_out",
  "workflow": "direct_llm",
  "answers": [
    {
      "question_id": "gate3-q38-wall-pset-property",
      "status": "answered",
      "answer": "The verified Pset_WallCommon property modification is FireRating on Wall L1 01, changed from \"60\" to \"90\" (GlobalId 1aO4mYJaTLLf6oT4DTcfok).",
      "predictions": [
        {
          "change_type": "property_modified",
          "entity_type": "IfcWall",
          "global_id": "1aO4mYJaTLLf6oT4DTcfok",
          "location": {
            "spatial_container": {
              "entity_type": "IfcBuildingStorey",
              "global_id": "16B$afW8bSivOT_ExWbFiL",
              "name": "Level 01"
            },
            "building_storey": {
              "entity_type": "IfcBuildingStorey",
              "global_id": "16B$afW8bSivOT_ExWbFiL",
              "name": "Level 01"
            }
          },
          "field": {
            "kind": "property",
            "property_set": "Pset_WallCommon",
            "name": "FireRating"
          },
          "old_value": "60",
          "new_value": "90",
          "evidence_refs": [
            {
              "source_type": "model_pair_summary",
              "source_path": "evals/inputs/development/gate3-model-pair-summary.json",
              "version_role": "source",
              "global_id": "1aO4mYJaTLLf6oT4DTcfok",
              "expected_present": true,
              "field": {
                "kind": "property",
                "property_set": "Pset_WallCommon",
                "name": "FireRating"
              }
            },
            {
              "source_type": "model_pair_summary",
              "source_path": "evals/inputs/development/gate3-model-pair-summary.json",
              "version_role": "revised",
              "global_id": "1aO4mYJaTLLf6oT4DTcfok",
              "expected_present": true,
              "field": {
                "kind": "property",
                "property_set": "Pset_WallCommon",
                "name": "FireRating"
              }
            }
          ]
        }
      ],
      "limitations": [
        "The comparison is limited to scalar Pset_WallCommon property values captured in the supplied model-pair summary."
      ]
    }
  ]
}
